{
  "kind": "memory-record",
  "schemaVersion": "1.0.0",
  "id": "build-product-2026-03-14T09-33-33-599Z-memory-3",
  "workflowId": "build-product",
  "workflowInstanceId": "build-product-2026-03-14T09-33-33-599Z",
  "scope": "project",
  "namespace": "build-product",
  "summary": "Architect Agent produced architecture-blueprint using system-architecture",
  "tags": [
    "build-product",
    "architecture",
    "system-architecture",
    "architect-agent"
  ],
  "taskId": "build-product-task-3",
  "runId": "build-product-task-3-run-1",
  "artifactFile": "tasks/results/build-product-2026-03-14T09-33-33-599Z/03-architecture.md",
  "createdAt": "2026-03-14T09:33:33.634Z"
}