{
  "kind": "memory-record",
  "schemaVersion": "1.0.0",
  "id": "build-product-2026-03-14T08-36-32-554Z-memory-4",
  "workflowId": "build-product",
  "workflowInstanceId": "build-product-2026-03-14T08-36-32-554Z",
  "scope": "project",
  "namespace": "build-product",
  "summary": "Engineer Agent produced implementation using code-generation",
  "tags": [
    "build-product",
    "development",
    "code-generation",
    "engineer-agent"
  ],
  "taskId": "build-product-task-4",
  "runId": "build-product-task-4-run-1",
  "artifactFile": "tasks/results/build-product-2026-03-14T08-36-32-554Z/04-development.md",
  "createdAt": "2026-03-14T08:36:32.596Z"
}