[
  {
    "kind": "memory-record",
    "schemaVersion": "1.0.0",
    "id": "build-product-2026-03-14T09-33-33-599Z-memory-1",
    "workflowId": "build-product",
    "workflowInstanceId": "build-product-2026-03-14T09-33-33-599Z",
    "scope": "project",
    "namespace": "build-product",
    "summary": "CEO Agent produced opportunity-summary using opportunity-analysis",
    "tags": [
      "build-product",
      "idea-analysis",
      "opportunity-analysis",
      "ceo-agent"
    ],
    "taskId": "build-product-task-1",
    "runId": "build-product-task-1-run-1",
    "artifactFile": "tasks/results/build-product-2026-03-14T09-33-33-599Z/01-idea-analysis.md",
    "createdAt": "2026-03-14T09:33:33.622Z"
  },
  {
    "kind": "memory-record",
    "schemaVersion": "1.0.0",
    "id": "build-product-2026-03-14T09-33-33-599Z-memory-2",
    "workflowId": "build-product",
    "workflowInstanceId": "build-product-2026-03-14T09-33-33-599Z",
    "scope": "project",
    "namespace": "build-product",
    "summary": "Product Agent produced prd using prd-generation",
    "tags": [
      "build-product",
      "product-design",
      "prd-generation",
      "product-agent"
    ],
    "taskId": "build-product-task-2",
    "runId": "build-product-task-2-run-1",
    "artifactFile": "tasks/results/build-product-2026-03-14T09-33-33-599Z/02-product-design.md",
    "createdAt": "2026-03-14T09:33:33.628Z"
  },
  {
    "kind": "memory-record",
    "schemaVersion": "1.0.0",
    "id": "build-product-2026-03-14T09-33-33-599Z-memory-3",
    "workflowId": "build-product",
    "workflowInstanceId": "build-product-2026-03-14T09-33-33-599Z",
    "scope": "project",
    "namespace": "build-product",
    "summary": "Architect Agent produced architecture-blueprint using system-architecture",
    "tags": [
      "build-product",
      "architecture",
      "system-architecture",
      "architect-agent"
    ],
    "taskId": "build-product-task-3",
    "runId": "build-product-task-3-run-1",
    "artifactFile": "tasks/results/build-product-2026-03-14T09-33-33-599Z/03-architecture.md",
    "createdAt": "2026-03-14T09:33:33.634Z"
  },
  {
    "kind": "memory-record",
    "schemaVersion": "1.0.0",
    "id": "build-product-2026-03-14T09-33-33-599Z-memory-4",
    "workflowId": "build-product",
    "workflowInstanceId": "build-product-2026-03-14T09-33-33-599Z",
    "scope": "project",
    "namespace": "build-product",
    "summary": "Engineer Agent produced implementation using code-generation",
    "tags": [
      "build-product",
      "development",
      "code-generation",
      "engineer-agent"
    ],
    "taskId": "build-product-task-4",
    "runId": "build-product-task-4-run-1",
    "artifactFile": "tasks/results/build-product-2026-03-14T09-33-33-599Z/04-development.md",
    "createdAt": "2026-03-14T09:33:33.640Z"
  },
  {
    "kind": "memory-record",
    "schemaVersion": "1.0.0",
    "id": "build-product-2026-03-14T09-33-33-599Z-memory-5",
    "workflowId": "build-product",
    "workflowInstanceId": "build-product-2026-03-14T09-33-33-599Z",
    "scope": "project",
    "namespace": "build-product",
    "summary": "QA Agent produced verification-report using integration-test",
    "tags": [
      "build-product",
      "testing",
      "integration-test",
      "qa-agent"
    ],
    "taskId": "build-product-task-5",
    "runId": "build-product-task-5-run-1",
    "artifactFile": "tasks/results/build-product-2026-03-14T09-33-33-599Z/05-testing.md",
    "createdAt": "2026-03-14T09:33:33.646Z"
  }
]